{
  "$schema": "https://json-schema.org/draft/2020-12/schema",
  "$id": "https://github.com/pulp-platform/hci/tracer/hci_response.schema.json",
  "title": "HCI-Core response transaction log",
  "description": "Log of the consumed responses (r_valid & r_ready) observed on an hci_core_intf interface by the hci_transaction_tracer module.",
  "type": "object",
  "required": ["schema", "interface", "transactions"],
  "additionalProperties": false,
  "properties": {
    "schema": {
      "description": "Schema tag, used to detect that the right kind of log was passed to a tool.",
      "const": "hci_transaction_response-v1"
    },
    "interface": { "$ref": "#/$defs/interface" },
    "path": {
      "description": "Hierarchical path of the tracer instance that produced this log.",
      "type": "string"
    },
    "transactions": {
      "description": "Responses in the order in which they were consumed.",
      "type": "array",
      "items": { "$ref": "#/$defs/response" }
    }
  },
  "$defs": {
    "hex": {
      "description": "Unsigned value, hexadecimal. A '0x' prefix, '_' separators and upper case are all accepted; 'x' and 'z' nibbles denote bits that were unknown in the simulator.",
      "type": "string",
      "pattern": "^(0[xX])?[0-9a-fA-FxXzZ_]+$"
    },
    "interface": {
      "description": "Design-time parameters of the traced HCI-Core interface.",
      "type": "object",
      "required": ["DW", "AW", "BW"],
      "additionalProperties": false,
      "properties": {
        "DW":  { "description": "Data width, in bits.", "type": "integer", "minimum": 1 },
        "AW":  { "description": "Address width, in bits.", "type": "integer", "minimum": 1 },
        "BW":  { "description": "Number of data bits covered by one byte-enable bit (8 by default).", "type": "integer", "minimum": 1 },
        "UW":  { "description": "User side-channel width, in bits; 0 means the side channel is unused and is not logged.", "type": "integer", "minimum": 0 },
        "IW":  { "description": "ID side-channel width, in bits; 0 means the side channel is unused and is not logged.", "type": "integer", "minimum": 0 },
        "EW":  { "description": "Data ECC side-channel width, in bits; 0 means the side channel is unused and is not logged.", "type": "integer", "minimum": 0 },
        "EHW": { "description": "Handshake ECC width, in bits. Not logged per transaction; recorded for completeness.", "type": "integer", "minimum": 0 }
      }
    },
    "response": {
      "description": "One consumed HCI-Core response.",
      "type": "object",
      "required": ["seq", "cycle", "r_data", "r_opc"],
      "additionalProperties": true,
      "properties": {
        "seq": {
          "description": "Index of this response in the log, from 0.",
          "type": "integer",
          "minimum": 0
        },
        "cycle": {
          "description": "Clock cycle of the r_valid & r_ready handshake, counted from the release of rst_ni. Metadata for waveform cross-reference only: it is never compared.",
          "type": "integer",
          "minimum": 0
        },
        "r_data": {
          "description": "Response data, DW bits.",
          "$ref": "#/$defs/hex"
        },
        "r_opc": {
          "description": "Response opcode / error flag.",
          "type": "integer",
          "enum": [0, 1]
        },
        "r_user": {
          "description": "Response user side channel, UW bits. Present only when UW > 0.",
          "$ref": "#/$defs/hex"
        },
        "r_id": {
          "description": "Response ID side channel, IW bits. Present only when IW > 0.",
          "$ref": "#/$defs/hex"
        },
        "r_ecc": {
          "description": "Response data ECC side channel, EW bits. Present only when EW > 0.",
          "$ref": "#/$defs/hex"
        }
      }
    }
  }
}
